11433,Grass Skirt,,,,Ordinary Drink,,Alcoholic,Old-fashioned glass,"In a shaker half-filled with ice cubes, combine the gin, triple sec, pineapple juice, and grenadine. Shake well. Pour into an old-fashioned glass and garnish with the pineapple slice.",,"In einem Shaker, der halb mit Eiswürfel gefüllt ist, den Gin, die Triple Sec, Ananassaft und Grenadine miteinander vermengen. Gut schütteln. In ein old-fashioned Glas geben und mit der Ananasscheibe garnieren.",,"In uno shaker riempito a metà con cubetti di ghiaccio, unisci il gin, il triple sec, il succo d'ananas e la granatina, versare in un bicchiere vecchio stile e guarnire con la fetta di ananas. Agitare bene",,,https://www.thecocktaildb.com/images/media/drink/qyvprp1473891585.jpg,Gin,Triple sec,Pineapple juice,Grenadine,Pineapple,,,,,,,,,,,1 1/2 oz ,1 oz ,1 oz ,1/2 tsp ,1 ,,,,,,,,,,,,,No,2016-09-14 23:19:46
17200,Grasshopper,,"IBA,ContemporaryClassic,Halloween",,Ordinary Drink,Contemporary Classics,Alcoholic,Cocktail glass,Pour ingredients into a cocktail shaker with ice. Shake briskly and then strain into a chilled cocktail glass.,,Zutaten in einen Cocktailshaker mit Eis geben. Zügig schütteln und dann in ein gekühltes Cocktailglas abseihen.,,"Versare gli ingredienti in uno shaker con ghiaccio.
Agitare energicamente e poi filtrare in una coppetta da cocktail fredda.",,,https://www.thecocktaildb.com/images/media/drink/aqm9el1504369613.jpg,Green Creme de Menthe,Creme de Cacao,Light cream,,,,,,,,,,,,,3/4 oz ,3/4 oz white ,3/4 oz ,,,,,,,,,,,,,,,No,2017-09-02 17:26:53
13497,Green Goblin,,,,Beer,,Alcoholic,Pint glass,"Cider First, Lager then Curacao",,"Zuerst Apfelwein, dann Lager und Curacao.",,"Sidro prima, Lager poi Curacao",,,https://www.thecocktaildb.com/images/media/drink/qxprxr1454511520.jpg,Cider,Lager,Blue Curacao,,,,,,,,,,,,,1/2 pint hard ,1/2 pint ,1 shot ,,,,,,,,,,,,,,,No,2016-02-03 14:58:40
17252,Greyhound,,,,Cocktail,,Alcoholic,Collins glass,"Add the vodka to a Collins glass filled with ice.
Top with grapefruit juice and stir.

",,Den Wodka in ein mit Eis gefülltes Collins-Glas geben. Mit Grapefruitsaft übergießen und umrühren.,,"Versa la vodka in un bicchiere Collins pieno di ghiaccio, aggiungi il succo di pompelmo e mescola.",,,https://www.thecocktaildb.com/images/media/drink/g5upn41513706732.jpg,Vodka,Grapefruit Juice,,,,,,,,,,,,,,1 1/2 oz,3 oz,,,,,,,,,,,,,,,,No,2017-12-19 18:05:32
14642,Grim Reaper,,,,Ordinary Drink,,Alcoholic,Old-fashioned glass,Mix Kahlua and 151 in glass. Quickly add ice and pour grenadine over ice to give ice red tint.,,"Kahlua und 151 in einem Glas mischen. Füge schnell Eis hinzu und gieße Grenadine über das Eis, um eine rötliche Farbe zu erhalten.",,"Mescola Kahlua e 151 nel bicchiere.
Aggiungi rapidamente il ghiaccio e versa la granatina sul ghiaccio per dare una sfumatura rosso ghiaccio.",,,https://www.thecocktaildb.com/images/media/drink/kztu161504883192.jpg,Kahlua,151 proof rum,Grenadine,,,,,,,,,,,,,1 oz ,1 oz Bacardi ,1 dash ,,,,,,,,,,,,,,,No,2017-09-08 16:06:32
12762,Grizzly Bear,,,,Ordinary Drink,,Alcoholic,Collins Glass,"Served over ice. Sounds nasty, but tastes great.",,"Serviert über Eis. Klingt übel, schmeckt aber super.",,"Mescolare tutti gli ingredienti tranne il latte in un bicchiere con ghiaccio.
Completare con il latte.
Servire.",,,https://www.thecocktaildb.com/images/media/drink/k6v97f1487602550.jpg,Amaretto,Jägermeister,Kahlua,Milk,,,,,,,,,,,,1 part ,1 part ,1 part ,2 1/2 parts ,,,,,,,,,,,,,,No,2017-02-20 14:55:50
16262,H.D.,,,,Coffee / Tea,,Alcoholic,Beer mug,Mix the whisky and Baileys Cream in a beer-glass (at least 50 cl). Fill the rest of the glass with coffee.,,Den Whisky und die Baileys Cream in einem Bierglas (mind. 50 cl) mischen. Füllen Sie den Rest des Glases mit Kaffee.,,"Mescolare il whisky e la crema di Baileys in un bicchiere da birra (almeno 50 cl).
Riempi il resto del bicchiere di caffè.",,,https://www.thecocktaildb.com/images/media/drink/upusyu1472667977.jpg,Whisky,Baileys irish cream,Coffee,,,,,,,,,,,,,4 cl ,8 cl ,,,,,,,,,,,,,,,,No,2016-08-31 19:26:18
178313,Halloween Punch,,Halloween,,Punch / Party Drink,,Alcoholic,Punch bowl,"Tip the cherry juice, orange peel, chilli, cinnamon sticks, cloves and ginger into a large saucepan. Simmer for 5 mins, then turn off the heat. Leave to cool, then chill for at least 4 hrs, or up to 2 days – the longer you leave it the more intense the flavours. If serving to young children, take the chilli out after a few hours.

When you’re ready to serve, pour the juice into a jug. Serve in glass bottles or glasses and pop a straw in each. If you're adding vodka, do so at this stage. Dangle a fangs sweet from each glass.",,,,"Versare il succo di ciliegia, la buccia d'arancia, il peperoncino, i bastoncini di cannella, i chiodi di garofano e lo zenzero in una grande casseruola. Cuocere a fuoco lento per 5 minuti, quindi spegnere il fuoco. Raffreddare per almeno 4 ore o fino a 2 giorni: più a lungo lo lasci, più intensi sono i sapori. Se servi ai bambini piccoli, togli il peperoncino dopo alcune ore.

Quando sei pronto per servire, versa il succo in una caraffa. Servire in bottiglie o bicchieri di vetro e inserire una cannuccia in ciascuno. Se stai aggiungendo la vodka, fallo in questa fase. Fai ciondolare una zanna dolce da ogni bicchiere.",,,https://www.thecocktaildb.com/images/media/drink/7hcgyj1571687671.jpg,Cherry Juice,Orange Peel,Red Chili Flakes,Cloves,Ginger,Vodka,,,,,,,,,,1 bottle,3,1,10,6,20 cl,,,,,,,,,,,,No,
12766,Happy Skipper,,,,Ordinary Drink,,Alcoholic,Highball glass,"Pour Captain Morgan's Spiced Rum over ice, fill glass to top with Ginger Ale. Garnish with lime. Tastes like a cream soda. Named for the Gilligan's Island reference (""The Captain"" *in* ""Ginger"" is a Happy Skipper!)",,"Captain Morgan's Spiced Rum über Eis in ein mit Eis gefüllten Glas giessen und mit Ginger Ale auffüllen. Mit Limette garnieren. Schmeckt wie ein Sahnesoda. Benannt nach der Referenz auf die Gilligan's Island (""The Captain"" *in* ""Ginger"" ist ein glücklicher Skipper!)",,"Versare il rum speziato di Captain Morgan sul ghiaccio, riempire il bicchiere con Ginger Ale. Guarnire con il lime. Chiamato per il riferimento a Gilligan's Island (""Il capitano"" * in * ""Ginger"" è uno skipper felice!)",,,https://www.thecocktaildb.com/images/media/drink/42w2g41487602448.jpg,Spiced rum,Ginger ale,Lime,Ice,,,,,,,,,,,,1 1/2 cl ,,,,,,,,,,,,,,,,,No,2017-02-20 14:54:09
11462,Harvey Wallbanger,,"IBA,ContemporaryClassic",,Ordinary Drink,Contemporary Classics,Alcoholic,Collins glass,"Stir the vodka and orange juice with ice in the glass, then float the Galliano on top. Garnish and serve.",,"Wodka und Orangensaft mit Eis im Glas verrühren, dann den Galliano darauf verteilen. Garnieren und servieren.",,"Mescolare la vodka e il succo d'arancia con ghiaccio nel bicchiere, successivamente versa nel drink il Galliano. Guarnire e servire.",,,https://www.thecocktaildb.com/images/media/drink/7os4gs1606854357.jpg,Vodka,Galliano,Orange juice,,,,,,,,,,,,,1 oz ,1/2 oz ,4 oz ,,,,,,,,,,,,,https://pxhere.com/en/photo/1435855,rawpixel.com,Yes,2017-09-02 17:28:45
11470,Havana Cocktail,,,,Ordinary Drink,,Alcoholic,Cocktail glass,"In a shaker half-filled with ice cubes, combine all of the ingredients. Shake well. Strain into a cocktail glass.",,"In einem Shaker, der halb mit Eiswürfel gefüllt ist, alle Zutaten vermengen. Gut schütteln. In ein Cocktailglas abseihen.",,"In uno shaker riempito a metà con cubetti di ghiaccio, unire tutti gli ingredienti.Agitare bene.Filtrare in un bicchiere da cocktail.",,,https://www.thecocktaildb.com/images/media/drink/59splc1504882899.jpg,Light rum,Pineapple juice,Lemon juice,,,,,,,,,,,,,1 oz ,1 oz ,1 tsp ,,,,,,,,,,,,,,,No,2017-09-08 16:01:40
11472,Hawaiian Cocktail,,,,Ordinary Drink,,Alcoholic,Cocktail glass,"Shake all ingredients with ice, strain into a cocktail glass, and serve.",,"Alle Zutaten mit Eis schütteln, in ein Cocktailglas abseihen und servieren.",,"Shakerare tutti gli ingredienti con ghiaccio, filtrare in una coppetta da cocktail e servire.",,,https://www.thecocktaildb.com/images/media/drink/ujoh9x1504882987.jpg,Gin,Triple sec,Pineapple juice,,,,,,,,,,,,,2 oz ,1/2 oz ,1 tblsp ,,,,,,,,,,,,,,,No,2017-09-08 16:03:07
17201,Hemingway Special,,"IBA,ContemporaryClassic",,Ordinary Drink,Contemporary Classics,Alcoholic,Cocktail glass,Pour all ingredients into a shaker with ice. Shake.,,Alle Zutaten in einen Shaker mit Eis geben. Schütteln.,,"Versare tutti gli ingredienti in uno shaker con ghiaccio.
Agita.",,,https://www.thecocktaildb.com/images/media/drink/jfcvps1504369888.jpg,Rum,Grapefruit Juice,Maraschino Liqueur,Lime Juice,,,,,,,,,,,,12 parts,8 parts,3 parts,3 parts,,,,,,,,,,,,,,No,2017-09-02 17:31:28
15813,Herbal flame,,,,Coffee / Tea,,Alcoholic,Mason jar,"Pour Hot Damn 100 in bottom of a jar or regular glass. Fill the rest of the glass with sweet tea. Stir with spoon, straw, or better yet a cinnamon stick and leave it in.",,"Gießen Sie Hot Damn 100 auf den Boden eines normalen Glases. Füllen Sie den Rest des Glases mit süßem Tee. Mit einem Löffel, Strohhalm oder besser noch einer Zimtstange umrühren und darin belassen.",,"Versa Hot Damn 100 sul fondo di un barattolo o di un bicchiere normale.
Riempi il resto del bicchiere con tè dolce.
Mescola con un cucchiaio, una cannuccia o, meglio ancora, una stecca di cannella e lasciala dentro.",,,https://www.thecocktaildb.com/images/media/drink/rrstxv1441246184.jpg,Hot Damn,Tea,,,,,,,,,,,,,,5 shots ,very sweet ,,,,,,,,,,,,,,,,No,2015-09-03 03:09:44
11476,Highland Fling Cocktail,,,,Ordinary Drink,,Alcoholic,Cocktail glass,Stir all ingredients (except olive) with ice and strain into a cocktail glass. Add the olive and serve.,,Alle Zutaten (außer Oliven) mit Eis verrühren und in ein Cocktailglas abseihen. Die Olive dazugeben und servieren.,,Mescolare tutti gli ingredienti (eccetto l'oliva) con ghiaccio e filtrare in una coppetta da cocktail.Aggiungere l'oliva e servire.,,,https://www.thecocktaildb.com/images/media/drink/0bkwca1492975553.jpg,Scotch,Sweet Vermouth,Orange bitters,Olive,,,,,,,,,,,,1 1/2 oz ,3/4 oz ,2 dashes ,1 ,,,,,,,,,,,,,,No,2017-04-23 20:25:53
17044,Homemade Kahlua,,,,Homemade Liqueur,,Alcoholic,Collins Glass,"Dissolve sugar in 2 cups of boiling water and add corn syrup. Dissolve the instant coffee in the remaining water. Pour syrup and coffee in a gallon jug. Let it cool. Add vodka and vanilla when cold. For the best result, let the mixture ""mature"" for 4-5 weeks.",,"Zucker in 2 Tassen kochendem Wasser auflösen und Maissirup hinzufügen. Lösen Sie den Instantkaffee in dem verbleibenden Wasser auf. Geben Sie Sirup und Kaffee in eine Kanne. Abkühlen lassen. Fügen Sie Wodka und Vanille hinzu, wenn sie kalt sind. Für das beste Ergebnis lassen Sie die Mischung 4-5 Wochen ""reifen"".",,"Sciogliere lo zucchero in 2 tazze di acqua bollente e aggiungere lo sciroppo di mais.
Sciogliere il caffè solubile nell'acqua rimasta.
Versare lo sciroppo e il caffè in una brocca da un gallone.
Lascialo raffreddare.
Aggiungere la vodka e la vaniglia quando sono fredde.
Per il miglior risultato lasciare ""maturare"" la miscela per 4-5 settimane.",,,https://www.thecocktaildb.com/images/media/drink/uwtsst1441254025.jpg,Sugar,Corn syrup,Coffee,Vanilla extract,Water,Vodka,,,,,,,,,,2 1/2 cups ,1 cup ,1 1/2 oz instant ,2 oz ,3 cups boiling ,1 fifth ,,,,,,,,,,,,No,2015-09-03 05:20:25
178316,Honey Bee,,Sweet,,Cocktail,,Alcoholic,Margarita glass,"Shake ingredients with crushed ice
",,,,Shakerare gli ingredienti con ghiaccio tritato,,,https://www.thecocktaildb.com/images/media/drink/vu8l7t1582475673.jpg,White Rum,Honey,Lemon Juice,,,,,,,,,,,,,6 cl,2 cl,2 cl,,,,,,,,,,,,,,,Yes,
17202,Horse's Neck,,"IBA,ContemporaryClassic",,Ordinary Drink,Contemporary Classics,Alcoholic,Highball glass,"Pour brandy and ginger ale directly into highball glass with ice cubes. Stir gently. Garnish with lemon zest. If desired, add dashes of Angostura Bitter.",,Gießen Sie Brandy und Ginger Ale direkt in das Highball-Glas mit Eiswürfeln. Vorsichtig umrühren. Mit Zitronenschale garnieren. Auf Wunsch können Sie auch Spritzer von Angostura Bitter hinzufügen.,,"Versare brandy e ginger ale direttamente in un bicchiere highball con cubetti di ghiaccio.
Mescola delicatamente.
Guarnire con la scorza di limone.
Se lo desideri, aggiungi un pizzico di Angostura Bitter.",,,https://www.thecocktaildb.com/images/media/drink/006k4e1504370092.jpg,Lemon peel,Brandy,Ginger ale,Bitters,,,,,,,,,,,,1 long strip ,2 oz ,5 oz ,2 dashes ,,,,,,,,,,,,,,No,2017-09-02 17:34:52
14782,Hot Creamy Bush,,,,Coffee / Tea,,Alcoholic,Irish coffee cup,Combine all ingredients in glass,,Alle Zutaten in einem Glas vermengen.,,Unisci tutti gli ingredienti in un bicchiere,,,https://www.thecocktaildb.com/images/media/drink/spvrtp1472668037.jpg,Irish whiskey,Baileys irish cream,Coffee,,,,,,,,,,,,,1 shot ,3/4 shot ,6 oz hot ,,,,,,,,,,,,,,,No,2016-08-31 19:27:17
178345,Hot Toddy,,Winter,,Cocktail,,Alcoholic,Irish coffee cup,"STEP 1
Whisk the whisky and honey together and split between 2 heatproof glasses. Add half of the cinnamon stick to each, then top up with 200ml boiling water.

STEP 2
Add a splash of lemon juice to each, then taste and add more to your preference. Finish each with a slice of lemon, studded with a clove, and serve immediately.",,,,"PASSO 1
Sbatti il whisky e il miele insieme e dividi in 2 bicchieri. Aggiungere metà della stecca di cannella a ciascuna, quindi rabboccare con 200 ml di acqua bollente.

PASSO 2
Aggiungi una spruzzata di succo di limone a ciascuno, quindi assaggia e aggiungi altro a tua preferenza. Terminate ciascuna con una fetta di limone, guarnire con uno spicchio, e servite subito.",,,https://www.thecocktaildb.com/images/media/drink/ggx0lv1613942306.jpg,Whiskey,Honey,Cinnamon,lemon,Cloves,,,,,,,,,,,50 ml,15 ml,1,1,2,,,,,,,,,,,https://www.flickr.com/photos/patruby/7343589018,,No,
17239,Hunter's Moon,,,,Cocktail,,Alcoholic,Balloon Glass,"Put the Bombay Sapphire, Martini Bianco, sugar syrup & blackberries in a cocktail shaker with lots of ice and shake vigorously before pouring into a balloon glass, topping up with lemonade and garnishing with a wedge of orange.",,"Den Bombay Saphir, Martini Bianco, Zuckersirup & Brombeeren in einen Cocktailshaker mit viel Eis geben und kräftig schütteln, bevor man sie in ein Ballonglas gießt, mit Limonade auffüllt und mit einem Stück Orange garniert.",,"Mettere il Bombay Sapphire, il Martini Bianco, lo sciroppo di zucchero e le more in uno shaker con molto ghiaccio e agitare energicamente prima di versare in un bicchiere a palloncino, rabboccare con limonata e guarnire con uno spicchio di arancia.",,,https://www.thecocktaildb.com/images/media/drink/t0iugg1509556712.jpg,Vermouth,Maraschino Cherry,Sugar Syrup,Lemonade,Blackberries,,,,,,,,,,,25 ml,15 ml,10 ml,100 ml,2,,,,,,,,,,,,,No,2017-11-01 17:18:32
13539,Ice Pick,,,,Ordinary Drink,,Alcoholic,Collins Glass,Put Vodka in glass fill with iced tea. Stir in lemon to taste.,,Wodka in ein Glas geben und mit Eistee füllen. Nach Belieben Zitrone unterrühren.,,"Metti la vodka in un bicchiere con del tè freddo.
Mescolare il limone a piacere.",,,https://www.thecocktaildb.com/images/media/drink/ypsrqp1469091726.jpg,Vodka,Iced tea,Lemon juice,,,,,,,,,,,,,1 1/2 oz ,6 oz ," to taste
",,,,,,,,,,,,,,,No,2016-07-21 10:02:06
12772,Iced Coffee Fillip,,,,Coffee / Tea,,Alcoholic,Coffee mug,Mix together in a coffee mug and chill before serving.,,In einer Kaffeetasse vermischen und vor dem Servieren kalt stellen.,,Mescolare insieme in una tazza da caffè e raffreddare prima di servire.,,,https://www.thecocktaildb.com/images/media/drink/sxtxrp1454514223.jpg,Kahlua,Coffee,,,,,,,,,,,,,,2 tsp ,Strong cold ,,,,,,,,,,,,,,,,No,2016-02-03 15:43:43
12706,Imperial Cocktail,,,,Cocktail,,Alcoholic,Cocktail glass,Shake with ice and strain into cocktail glass.,,Mit Eis schütteln und in ein Cocktailglas abseihen.,,Shakerare con ghiaccio e filtrare nella coppetta da cocktail.,,,https://www.thecocktaildb.com/images/media/drink/bcsj2e1487603625.jpg,Lime juice,Gin,Aperol,,,,,,,,,,,,,4 cl ,2 cl ,4 cl ,,,,,,,,,,,,,,,No,2017-02-20 15:13:45
11524,Imperial Fizz,,,,Ordinary Drink,,Alcoholic,Highball glass,"Shake all ingredients (except carbonated water) with ice and strain into a highball glass over two ice cubes. Fill with carbonated water, stir, and serve.",,"Alle Zutaten (außer kohlensäurehaltigem Wasser) mit Eis schütteln und über zwei Eiswürfel in ein Highball-Glas abseihen. Mit kohlensäurehaltigem Wasser auffüllen, umrühren und servieren.",,"Shakerare tutti gli ingredienti (eccetto l'acqua gassata) con ghiaccio e filtrare in un bicchiere highball su due cubetti di ghiaccio. Riempi con acqua gassata, mescola e servi.",,,https://www.thecocktaildb.com/images/media/drink/zj1usl1504884548.jpg,Light rum,Blended whiskey,Lemon,Powdered sugar,Carbonated water,,,,,,,,,,,1/2 oz ,1 1/2 oz ,Juice of 1/2 ,1 tsp ,,,,,,,,,,,,,,No,2017-09-08 16:29:08
13971,Irish Coffee,,"IBA,ContemporaryClassic",,Coffee / Tea,Contemporary Classics,Alcoholic,Irish coffee cup,"Heat the coffee, whiskey and sugar; do not boil. Pour into glass and top with cream; serve hot.",,"Kaffee, Whiskey und Zucker erhitzen; nicht kochen lassen. In ein Glas geben und mit Sahne übergießen; heiß servieren.",,"Riscaldare il caffè, il whisky e lo zucchero; non bollire. Versare nel bicchiere e ricoprire con la panna; servito caldo.",,,https://www.thecocktaildb.com/images/media/drink/sywsqw1439906999.jpg,Irish whiskey,Coffee,Sugar,Whipped cream,,,,,,,,,,,,1 1/2 oz ,8 oz ,1 tsp ,1 tblsp ,,,,,,,,,,,,,,No,2015-08-18 15:09:59
12820,Irish Cream,,,,Homemade Liqueur,,Alcoholic,Irish coffee cup,Mix scotch and milk. Add half-and-half. Add rest.,,Halb Scotch und halb Milch mischen. Rest hinzufügen.,,"Mescola tutti gli ingredienti in un frullatore fino a ottenere un composto omogeneo.
Da tenere in frigorifero. Servire con ghiaccio o miscelato in cocktail, agitando prima di ogni utilizzo",,,https://www.thecocktaildb.com/images/media/drink/90etyl1504884699.jpg,Scotch,Half-and-half,Condensed milk,Coconut syrup,Chocolate syrup,,,,,,,,,,,1 cup ,1 1/4 cup ,1 can sweetened ,3 drops ,1 tblsp ,,,,,,,,,,,,,No,2017-09-08 16:31:39
16987,Irish Curdling Cow,,,,Cocktail,,Alcoholic,Highball glass,"Pour Irish Cream, Vodka, and Bourbon in a glass. Add some ice and mix in the orange juice.",,"Geben Sie Irish Cream, Wodka und Bourbon in ein Glas. Etwas Eis dazugeben und den Orangensaft unterrühren.",,"Versare Irish Cream, Vodka e Bourbon in un bicchiere.
Aggiungere un po’ di ghiaccio e mescolare il succo d'arancia.",,,https://www.thecocktaildb.com/images/media/drink/yrhutv1503563730.jpg,Baileys irish cream,Bourbon,Vodka,Orange juice,,,,,,,,,,,,3/4 oz ,3/4 oz ,3/4 oz ,2-3 oz ,,,,,,,,,,,,,,No,2017-08-24 09:35:30
17015,Irish Russian,,,,Beer,,Alcoholic,Highball glass,Add the ingredients in the order listed in the recipe. Care must be taken when adding the Guinness to prevent an excess of foam. Do Not add ice.,,"Fügen Sie die Zutaten gemäß der im Rezept angegebenen Reihenfolge hinzu. Beim Hinzufügen des Guinness ist Vorsicht geboten, um einen Schaumüberschuss zu vermeiden. Füge kein Eis hinzu.",,"Aggiungere gli ingredienti nell'ordine indicato
Bisogna fare attenzione quando si aggiunge la Guinness per evitare un eccesso di schiuma.
Non aggiungere ghiaccio.",,,https://www.thecocktaildb.com/images/media/drink/swqurw1454512730.jpg,Vodka,Kahlua,Coca-Cola,Guinness stout,,,,,,,,,,,,1 shot ,1 shot ,1 dash ,Fill with ,,,,,,,,,,,,,,No,2016-02-03 15:18:50
11528,Irish Spring,,,,Ordinary Drink,,Alcoholic,Collins glass,"Pour all ingredients (except orange slice and cherry) into a collins glass over ice cubes. Garnish with the slice of orange, add the cherry on top, and serve.",,"Alle Zutaten (außer Orangenscheibe und Kirsche) in ein Collins-Glas über Eiswürfel gießen. Mit der Orangenscheibe garnieren, die Kirsche darüber geben und servieren.",,"Versare tutti gli ingredienti (tranne la fetta d'arancia e la ciliegia) in un bicchiere Collins con cubetti di ghiaccio. Guarnire con la fetta d'arancia, aggiungere la ciliegina sulla torta e servire.",,,https://www.thecocktaildb.com/images/media/drink/sot8v41504884783.jpg,Irish whiskey,Peach brandy,Orange juice,Sweet and sour,Orange,Cherry,,,,,,,,,,1 oz ,1/2 oz ,1 oz ,1 oz ,1 slice ,1 ,,,,,,,,,,,,No,2017-09-08 16:33:03
11542,Jack Rose Cocktail,,Beach,,Ordinary Drink,,Alcoholic,Cocktail glass,"Shake all ingredients with ice, strain into a cocktail glass, and serve.",,"Alle Zutaten mit Eis schütteln, in ein Cocktailglas abseihen und servieren.",,"Shakerare tutti gli ingredienti con ghiaccio, filtrare in una coppetta da cocktail e servire.",,,https://www.thecocktaildb.com/images/media/drink/uuqqrv1439907068.jpg,Apple brandy,Grenadine,Lime,,,,,,,,,,,,,1 1/2 oz ,1 tsp ,Juice of 1/2 ,,,,,,,,,,,,,,,No,2015-08-18 15:11:08
16275,Jack's Vanilla Coke,,,,Other/Unknown,,Alcoholic,Old-fashioned glass,"After pouring in your ingredients, and adding 3-5 ice cubes, according to taste. Stir the drink with a stirrer to get the Vanilla off the bottom.",,"Nach dem Einfüllen der Zutaten und dem Hinzufügen von 3-5 Eiswürfeln je nach Geschmack, rühren Sie das Getränk mit einem Rührer um, um die Vanille vom Boden zu lösen.",,"Dopo aver versato gli ingredienti e aver aggiunto 3-5 cubetti di ghiaccio, a piacere.
Mescola la bevanda con un agitatore per eliminare la vaniglia dal fondo.",,,https://www.thecocktaildb.com/images/media/drink/kjnt7z1504793319.jpg,Ice,Tennessee whiskey,Vanilla extract,Coca-Cola,,,,,,,,,,,,4-5 ,2 oz ,1 tsp ,10-12 oz ,,,,,,,,,,,,,,No,2017-09-07 15:08:39
13847,Jackhammer,,,,Ordinary Drink,,Alcoholic,Collins Glass,"Serve over ice- Warning,Deadly!",,"Servieren Sie über Eis. Warnung, tödlich!",,"Servire con ghiaccio - Attenzione, mortale!",,,https://www.thecocktaildb.com/images/media/drink/9von5j1504388896.jpg,Jack Daniels,Amaretto,,,,,,,,,,,,,,1 oz ,1 oz ,,,,,,,,,,,,,,,,No,2017-09-02 22:48:16
17178,Jam Donut,,,,Shot,,Alcoholic,Shot glass,"Coat the rim of a shot glass with sugar using sugar syrup to stick. Add the Chambord raspberry liqueur to the shot glass, and carefully layer the Baileys Irish Cream on top. Serve.",,Den Rand eines Schnapsglases mit Zucker und Zuckersirup bestreichen. Geben Sie den Chambord Himbeerlikör in das Schnapsglas und geben Sie die Baileys Irish Cream vorsichtig darüber. Servieren.,,"Rivestire il bordo di un bicchierino di zucchero con lo sciroppo di zucchero per attaccare.
Aggiungere il liquore al lampone di Chambord nel bicchierino e sovrapporre con cura la crema irlandese Baileys.",,,https://www.thecocktaildb.com/images/media/drink/uuytrp1474039804.jpg,Baileys irish cream,Chambord raspberry liqueur,Sugar syrup,Sugar,,,,,,,,,,,,2/3 oz,1/3 oz,1 tsp,2 pinches,,,,,,,,,,,,,,No,2016-09-16 16:30:04
14095,Jamaica Kiss,,,,Milk / Float / Shake,,Alcoholic,Hurricane glass,Fill a tumbler with ice cubes. Add a shot of Tia Maria and a shot of Jamaican light rum. Fill the tumbler with milk. Blend until smooth and serve immediately.,,"Füllen Sie einen Becher mit Eiswürfeln. Füge einen Schuss Tia Maria und einen Schuss jamaikanischen leichten Rum hinzu. Füllen Sie den Becher mit Milch. Mischen, bis sie glatt sind und sofort servieren.",,"Riempi un bicchiere con cubetti di ghiaccio.
Aggiungi un bicchierino di Tia Maria e un bicchierino di rum chiaro giamaicano.
Riempi il bicchiere di latte.
Frulla fino a ottenere un composto omogeneo e servi immediatamente.",,,https://www.thecocktaildb.com/images/media/drink/urpvvv1441249549.jpg,Coffee liqueur,Light rum,Ice,Milk,,,,,,,,,,,,1 shot ,1 shot Jamaican ,cubes,,,,,,,,,,,,,,,No,2015-09-03 04:05:49
15825,Jamaican Coffee,,,,Coffee / Tea,,Alcoholic,Champagne flute,"Stir the rum, coffee and water together. Top with the whipped cream. Sprinkle with a pinch of well ground coffee and drink with a straw.",,"Rum, Kaffee und Wasser miteinander verrühren. Mit der geschlagenen Sahne bedecken. Mit einer Prise gut gemahlenem Kaffee bestreuen und mit einem Strohhalm trinken.",,"Mescola rum, caffè e acqua insieme.
Completare con la panna montata.
Cospargere con un pizzico di caffè ben macinato e bere con una cannuccia.",,,https://www.thecocktaildb.com/images/media/drink/xqptps1441247257.jpg,Rum,Coffee,Water,Whipped cream,,,,,,,,,,,,1/6 glass ,1/6 glass strong black ,1/2 glass cold ,,,,,,,,,,,,,,,No,2015-09-03 03:27:37
11558,Japanese Fizz,,,,Ordinary Drink,,Alcoholic,Highball glass,"Shake all ingredients (except carbonated water) with ice and strain into a highball glass over two ice cubes. Fill with carbonated water, stir, and serve.",,"Alle Zutaten (außer kohlensäurehaltigem Wasser) mit Eis schütteln und über zwei Eiswürfel in ein Highball-Glas abseihen. Mit kohlensäurehaltigem Wasser auffüllen, umrühren und servieren.",,"Shakerare tutti gli ingredienti (eccetto l'acqua gassata) con ghiaccio e filtrare in un bicchiere highball su due cubetti di ghiaccio. Riempi con acqua gassata, mescola e servi.",,,https://www.thecocktaildb.com/images/media/drink/37vzv11504884831.jpg,Blended whiskey,Lemon,Powdered sugar,Port,Egg white,Carbonated water,,,,,,,,,,1 1/2 oz ,Juice of 1/2 ,1 tsp ,1 tblsp,1 ,,,,,,,,,,,,,No,2017-09-08 16:33:51
