14586,Orange Push-up,,,,Ordinary Drink,,Alcoholic,Hurricane glass,Combine liquors in a blender. Add a half scoop of ice and blend. Garnish with an orange and cherry flag. So good it will melt in your mouth!!!,,"Mische Liköre in einem Mixer. Eine halbe Kugel Eis hinzufügen und untermischen. Mit einer Orange- und Kirschfahne garnieren. So gut, dass es in deinem Mund schmilzt.",,"Unisci i liquori in un frullatore.
Aggiungere mezzo misurino di ghiaccio e frullare.
Guarnire con una bandiera di arancia e ciliegia.",,,https://www.thecocktaildb.com/images/media/drink/mgf0y91503565781.jpg,Spiced rum,Grenadine,Orange juice,Sour mix,,,,,,,,,,,,1.5 oz ,0.5 oz ,4 oz ,1 splash ,,,,,,,,,,,,,,No,2017-08-24 10:09:41
178341,Orange Rosemary Collins,,Citrus,,Cocktail,,Alcoholic,Highball glass,Add the spirits to the bottom of the glass and top equally with the mixer drinks. Garnish with orange slices inside the glass as well as some rosemary on top.,,,,Aggiungere gli alcolici sul fondo del bicchiere e sopra ugualmente con le bevande del mixer. Guarnire con fettine d'arancia nel bicchiere e sopra un po 'di rosmarino.,,,https://www.thecocktaildb.com/images/media/drink/mokcas1604179977.jpg,Gin,Orange Juice,Lemon Juice,Rosemary Syrup,Soda Water,Rosemary,Orange Peel,,,,,,,,,1 shot,Top,Top,25 ml,Top,Garnish with,Garnish with,,,,,,,,,,,No,
16995,Orange Whip,,,,Other/Unknown,,Alcoholic,Collins Glass,Pour ingredients over ice and stir.,,Zutaten über Eis gießen und umrühren.,,Versare gli ingredienti sul ghiaccio e mescolare.,,,https://www.thecocktaildb.com/images/media/drink/ttyrxr1454514759.jpg,Orange juice,Rum,Vodka,Cream,Ice,,,,,,,,,,,4 oz ,1 oz ,1 oz ,1 package ,Over ,,,,,,,,,,,,,No,2016-02-03 15:52:39
13499,Oreo Mudslide,,,,Ordinary Drink,,Alcoholic,Collins Glass,"Blend Vodka, Kahlua, Bailey's, ice-cream and the Oreo well in a blender. Pour into a large frosted glass. Garnish with whipped cream and a cherry.",,"Mischen Sie Wodka, Kahlua, Bailey's, Eis und den Oreo gut in einem Mixer. In ein großes mattiertes Glas geben. Mit Schlagsahne und einer Kirsche garnieren.",,"Mescola bene Vodka, Kahlua, Baileys, gelato e un oreo in un frullatore. Versare in un grande bicchiere. Guarnire con panna montata e una ciliegia.",,,https://www.thecocktaildb.com/images/media/drink/tpwwut1468925017.jpg,Vodka,Kahlua,Baileys irish cream,Vanilla ice-cream,Oreo cookie,,,,,,,,,,,1 oz ,1 oz ,1 oz ,2 scoops ,1 ,,,,,,,,,,,,,No,2016-07-19 11:43:37
11872,Orgasm,,,,Ordinary Drink,,Alcoholic,Cocktail glass,"Shake all ingredients with ice, strain into a chilled cocktail glass, and serve.",,,,"Shakerare tutti gli ingredienti con ghiaccio, filtrare in una coppetta da cocktail fredda e servire.",,,https://www.thecocktaildb.com/images/media/drink/vr6kle1504886114.jpg,Creme de Cacao,Amaretto,Triple sec,Vodka,Light cream,,,,,,,,,,,1/2 oz white ,1/2 oz ,1/2 oz ,1/2 oz ,1 oz ,,,,,,,,,,,,,No,2017-09-08 16:55:14
13200,Owen's Grandmother's Revenge,,,,Ordinary Drink,,Alcoholic,Highball glass,Add ingredients and mix in blender.,,Zutaten im Mixer vermengen.,,Aggiungere gli ingredienti e mescola nel frullatore.,,,https://www.thecocktaildb.com/images/media/drink/0wt4uo1503565321.jpg,Whiskey,Beer,Lemonade,Ice,,,,,,,,,,,,12 oz ,12 oz ,12 oz frozen ,1 cup crushed ,,,,,,,,,,,,,,No,2017-08-24 10:02:02
17253,Paloma,,,,Cocktail,,Alcoholic,Collins glass,Stir together and serve over ice.,,Zusammenrühren und über Eis servieren.,,Mescolate e servite con ghiaccio.,,,https://www.thecocktaildb.com/images/media/drink/samm5j1513706393.jpg,Grape Soda,Tequila,,,,,,,,,,,,,,3 oz,1 1/2 oz,,,,,,,,,,,,,,,,No,2017-12-19 17:59:53
17190,Paradise,,IBA,https://www.youtube.com/watch?v=vu1rVWo4rQ8,Ordinary Drink,Unforgettables,Alcoholic,Cocktail glass,Shake together over ice. Strain into cocktail glass and serve chilled.,,Zusammen über Eis schütteln. In ein Cocktailglas abseihen und gekühlt servieren.,,Shakerare tutti gli ingredienti insieme al ghiaccio. Filtrare nella coppetta da cocktail e servire freddo.,,,https://www.thecocktaildb.com/images/media/drink/ejozd71504351060.jpg,Gin,Apricot Brandy,Orange Juice,,,,,,,,,,,,,7 parts,4 parts,3 parts ,,,,,,,,,,,,,,,No,2017-09-02 12:17:40
178323,Passion Fruit Martini,,,,Cocktail,,Alcoholic,Cocktail glass,Pour all ingredients into a glass and stir. Garnish with half a passion fruit piece.,,,,Versare tutti gli ingredienti in un bicchiere e mescolare. Guarnire con mezzo pezzo di frutto della passione.,,,https://www.thecocktaildb.com/images/media/drink/6trfve1582473527.jpg,Vodka,Sugar Syrup,Passion fruit juice,,,,,,,,,,,,,1 shot,1/2 shot,Full Glass,,,,,,,,,,,,,,,Yes,
17249,Pegu Club,,,,Cocktail,,Alcoholic,Cocktail glass,"Shake, strain, up, cocktail glass",,"Schütteln, abseihen, auffüllen, Cocktailglas.",,"Agitare, filtrare, su un bicchiere da cocktail",,,https://www.thecocktaildb.com/images/media/drink/jfkemm1513703902.jpg,Gin,Orange Curacao,Lime Juice,Angostura Bitters,Orange Bitters,,,,,,,,,,,1 1/2 oz,3/4 oz,3/4 oz,1 dash,1 dash,,,,,,,,,,,,,No,2017-12-19 17:18:23
17829,Penicillin,,,,Cocktail,,Alcoholic,Old-fashioned glass,"Shake blended Scotch, lemon juice, honey syrup and ginger syrup with ice. Strain over large ice in chilled rocks glass. Float smoky Scotch on top (be sure to use a smoky Scotch such as an Islay single malt). Garnish with candied ginger.",,"Schütteln Sie gemischten Scotch, Zitronensaft, Honigsirup und Ingwersirup mit Eis. Über großes Eis in gekühltem Rocks Glas abseihen. Geben Sie rauchigen Scotch darauf (verwenden Sie unbedingt einen rauchigen Scotch wie z.B. Islay Single Malt). Mit kandiertem Ingwer garnieren. ",,"Shakerare Scotch Blended, succo di limone, sciroppo di miele e sciroppo di zenzero con ghiaccio.
Filtrare con del ghiaccio in un bicchiere freddo.
Versa sopra il bicchiere uno scotch fumoso (assicurati di usare uno scotch affumicato come un single malt di Islay).
Guarnire con lo zenzero candito.",,,https://www.thecocktaildb.com/images/media/drink/hc9b1a1521853096.jpg,Blended Scotch,Lemon Juice,Honey syrup,Ginger Syrup,Islay single malt Scotch,,,,,,,,,,,2 oz,3/4 oz,2 tsp,2 tsp,1/4 oz,,,,,,,,,,,,,No,2018-03-24 00:58:16
17207,Pina Colada,,"IBA,ContemporaryClassic",,Ordinary Drink,Contemporary Classics,Alcoholic,Collins glass,"Mix with crushed ice in blender until smooth. Pour into chilled glass, garnish and serve.",,"Mit zerstoßenem Eis im Mixer mischen, bis es glatt ist. In ein gekühltes Glas geben, garnieren und servieren.",,"Mescolare con ghiaccio tritato in un frullatore fino a che liscio.
Versare in un bicchiere freddo, guarnire e servire.",,,https://www.thecocktaildb.com/images/media/drink/cpf4j51504371346.jpg,Light rum,Coconut milk,Pineapple,,,,,,,,,,,,,3 oz ,3 tblsp ,3 tblsp ,,,,,,,,,,,,,,,No,2017-09-02 17:55:46
178327,Pineapple Paloma,,,,Cocktail,,Alcoholic,Collins glass,"Rub the rim of each glass with lime slice and dip into salt.
Add ice, tequila, grapefruit juice, lime juice and top with pineapple soda.
Give it a quick stir.
Garnish with fresh pineapple or lime.",,,,"Strofina il bordo di ogni bicchiere con uno spicchio di lime e salalo.
Aggiungi ghiaccio, tequila, succo di pompelmo, succo di lime e aggiungi la soda all'ananas.
Dagli una rapida mescolata.
Guarnire con ananas fresco o lime.",,,https://www.thecocktaildb.com/images/media/drink/pg8iw31593351601.jpg,Tequila,Grapefruit Juice,Fresh Lime Juice,Pineapple Juice,Lime,Pepper,,,,,,,,,,4 oz,4 oz,1 oz,8 oz,Garnish with,Rimmed,,,,,,,,,,,,Yes,
11936,Pink Gin,,,,Ordinary Drink,,Alcoholic,White wine glass,"Pour the bitters into a wine glass. Swirl the glass to coat the inside with the bitters, shake out the excess. Pour the gin into the glass. Do not add ice.",,"Den Bitter in ein Weinglas gießen. Das Glas umrühren, um die Innenseite mit dem Bitter zu überziehen, den Überschuss ausschütten. Gießen Sie den Gin in das Glas. Füge kein Eis hinzu.",,"Distribuire nei bicchieri i cubetti di ghiaccio, i lamponi, il pepe e il gin e versare l’acqua tonica.",,,https://www.thecocktaildb.com/images/media/drink/qyr51e1504888618.jpg,Bitters,Gin,,,,,,,,,,,,,,3 dashes ,2 oz ,,,,,,,,,,,,,,,,No,2017-09-08 17:36:58
11938,Pink Lady,,,,Ordinary Drink,,Alcoholic,Cocktail glass,"Shake all ingredients with ice, strain into a cocktail glass, and serve.",,"Alle Zutaten mit Eis schütteln, in ein Cocktailglas abseihen und servieren.",,"Shakerare tutti gli ingredienti con ghiaccio, filtrare in una coppetta da cocktail e servire.",,,https://www.thecocktaildb.com/images/media/drink/5ia6j21504887829.jpg,Gin,Grenadine,Light cream,Egg white,,,,,,,,,,,,1 1/2 oz ,1 tsp ,1 tsp ,1 ,,,,,,,,,,,,,,No,2017-09-08 17:23:49
178354,Pink Moon,,"Fresh, Summer, Colourful, Nature",,Cocktail,,Alcoholic,Whiskey Glass,"Slowly shake in a shaker with ice, strain into a square whiskey glass. Top with fresh ice. Add the blackberries to garnish. Add flowers and a green leaf for a special look!",,,,,,,https://www.thecocktaildb.com/images/media/drink/lnjoc81619696191.jpg,Gin,Coconut Liqueur,Elderflower cordial,Lime Juice,Blackberries,,,,,,,,,,,1 shot,1 shot,25 ml,30 ml,Garnish with,,,,,,,,,,,Instagram @ cocktailsplace,,No,
13535,Pink Panty Pulldowns,,,,Ordinary Drink,,Alcoholic,Collins Glass,Shake well,,Gut schütteln,,Versa in un bicchiere tutti gli ingredienti. Agitare bene,,,https://www.thecocktaildb.com/images/media/drink/squsuy1468926657.jpg,Sprite,Pink lemonade,Vodka,,,,,,,,,,,,,1 L ,2 cups ,2 cups ,,,,,,,,,,,,,,,No,2016-07-19 12:10:57
16992,Pink Penocha,,,,Punch / Party Drink,,Alcoholic,Punch bowl,mix all ingredients into bowl keep iced stir frequently,,Alle Zutaten in die Schüssel geben und gleichmäßig rühren.,,"mescolare tutti gli ingredienti nella ciotola, tenere la bevanda sempre fredda, mescolare spesso",,,https://www.thecocktaildb.com/images/media/drink/6vigjx1503564007.jpg,Everclear,Vodka,Peach schnapps,Orange juice,Cranberry juice,,,,,,,,,,,750 ml ,1750 ml ,1750 ml ,1 gal ,1 gal ,,,,,,,,,,,,,No,2017-08-24 09:40:07
13214,Pisco Sour,,"IBA,NewEra",,Cocktail,New Era Drinks,Alcoholic,Cocktail glass,"Vigorously shake and strain contents in a cocktail shaker with ice cubes, then pour into glass and garnish with bitters.
",,"Den Inhalt in einem Cocktailshaker mit Eiswürfeln kräftig schütteln und abseihen, dann in ein Glas gießen und mit Bitter garnieren.",,"Shakerare vigorosamente e filtrare il contenuto in uno shaker con cubetti di ghiaccio, quindi versare in un bicchiere e guarnire con bitter.",,,https://www.thecocktaildb.com/images/media/drink/tsssur1439907622.jpg,Pisco,Lemon juice,Sugar,Ice,Egg White,,,,,,,,,,,2 oz ,1 oz ,1-2 tblsp ,1,,,,,,,,,,,,,,No,2015-08-18 15:20:22
17191,Planter's Punch,,"IBA,Classic",https://www.youtube.com/watch?v=oH7PP_lV6J8,Punch / Party Drink,Unforgettables,Alcoholic,Collins glass,"Pour all ingredients, except the bitters, into shaker filled with ice. Shake well. Pour into large glass, filled with ice. Add Angostura bitters, ""on top"". Garnish with cocktail cherry and pineapple.",,"Alle Zutaten, außer den Bitterstoffen, in einen mit Eis gefüllten Shaker geben. Gut schütteln. In ein großes, mit Eis gefülltes Glas gießen. Füge Angostura-Bitter hinzu, ""on top"". Mit Cocktailkirsche und Ananas garnieren.",,"Versare tutti gli ingredienti, in uno shaker pieno di ghiaccio.
Agitare bene.
Versare in un bicchiere capiente, pieno di ghiaccio.
Guarnire con ananas.",,,https://www.thecocktaildb.com/images/media/drink/fdk8a31606854815.jpg,Dark rum,Orgeat syrup,Orange juice,Pineapple juice,,,,,,,,,,,,1 part ,1/2 part ,2 parts ,1 part ,,,,,,,,,,,,https://www.flickr.com/photos/mstyne/29751995765/,Michael Styne,Yes,2017-09-02 12:23:04
13072,Popped cherry,,,,Ordinary Drink,,Alcoholic,Highball glass,Served over ice in a tall glass with a popped cherry (can add more popped cherries if in the mood)!,,"Serviert über Eis in einem hohen Glas mit einer entsteinten Kirsche (kann mehr entsteinte Kirschen hinzufügen, wenn sie in der Stimmung sind)!",,Servito con ghiaccio in un bicchiere alto con una ciliegia snocciolata (puoi aggiungere più ciliegie snocciolata se ne hai voglia)!,,,https://www.thecocktaildb.com/images/media/drink/sxvrwv1473344825.jpg,Vodka,Cherry liqueur,Cranberry juice,Orange juice,,,,,,,,,,,,2 oz ,2 oz ,4 oz ,4 oz ,,,,,,,,,,,,,,No,2016-09-08 15:27:05
11959,Poppy Cocktail,,,,Ordinary Drink,,Alcoholic,Cocktail glass,"Shake ingredients with ice, strain into a cocktail glass, and serve.",,"Die Zutaten mit Eis schütteln, in ein Cocktailglas abseihen und servieren.",,"Shakerare gli ingredienti con ghiaccio, filtrare in una coppetta da cocktail e servire.",,,https://www.thecocktaildb.com/images/media/drink/cslw1w1504389915.jpg,Gin,Creme de Cacao,,,,,,,,,,,,,,1 1/2 oz ,3/4 oz white ,,,,,,,,,,,,,,,,No,2017-09-02 23:05:15
178357,Pornstar Martini,,"Adult, Shot, Bubbly",,Cocktail,,Alcoholic,Cocktail glass,Straight: Pour all ingredients into mixing glass with ice cubes. Shake well. Strain in chilled martini cocktail glass. Cut passion fruit in half and use as garnish. Pour prosecco into a chilled shot glass and serve alongside the martini.,,,,,,,https://www.thecocktaildb.com/images/media/drink/xjhjdf1630406071.jpg,Vodka,Passoa,Passion fruit juice,Lime,Prosecco,,,,,,,,,,,3 cl,3 cl,1 cl,1 cl,1 shot,,,,,,,,,,,https://www.instagram.com/p/CTMhXyaIvIT,,No,
11961,Port And Starboard,,,,Ordinary Drink,,Alcoholic,Pousse cafe glass,"Pour carefully into a pousse-cafe glass, so that creme de menthe floats on grenadine. Serve without mixing.",,"Vorsichtig in ein Pousse-Café-Glas gießen, damit die Creme de Menthe auf Grenadine schwimmt. Ohne zu mischen servieren.",,"Versare con cura in un bicchiere pousse-cafè, in modo che la crema di menta galleggi sulla granatina. Servire senza mescolare.",,,https://www.thecocktaildb.com/images/media/drink/wxvupx1441553911.jpg,Grenadine,Green Creme de Menthe,,,,,,,,,,,,,,1 tblsp ,1/2 oz ,,,,,,,,,,,,,,,,No,2015-09-06 16:38:31
11963,Port Wine Cocktail,,,,Ordinary Drink,,Alcoholic,Cocktail glass,"Stir ingredients with ice, strain into a cocktail glass, and serve.",,"Zutaten mit Eis verrühren, in ein Cocktailglas abseihen und servieren.",,"Mescolare gli ingredienti con ghiaccio, filtrare in una coppetta da cocktail e servire.",,,https://www.thecocktaildb.com/images/media/drink/qruprq1441553976.jpg,Port,Brandy,,,,,,,,,,,,,,2 1/2 oz ,1/2 tsp ,,,,,,,,,,,,,,,,No,2015-09-06 16:39:36
11965,Port Wine Flip,,,,Ordinary Drink,,Alcoholic,Whiskey sour glass,Shake all ingredients (except nutmeg) with ice and strain into a whiskey sour glass. Sprinkle nutmeg on top and serve.,,Alle Zutaten (außer Muskatnuss) mit Eis schütteln und in ein Whiskey-Sourglas abseihen. Muskatnuss darüber streuen und servieren.,,Shakerare tutti gli ingredienti (tranne la noce moscata) con ghiaccio e filtrare in un bicchiere da whisky sour. Cospargere di noce moscata e servire.,,,https://www.thecocktaildb.com/images/media/drink/vrprxu1441553844.jpg,Port,Light cream,Powdered sugar,Egg,Nutmeg,,,,,,,,,,,1 1/2 oz ,2 tsp ,1 tsp ,1 whole ,,,,,,,,,,,,,,No,2015-09-06 16:37:24
17192,Porto flip,,"IBA,Classic",https://www.youtube.com/watch?v=2jtoa_t7g94,Ordinary Drink,Unforgettables,Alcoholic,Cocktail glass,"Shake ingredients together in a mixer with ice. Strain into glass, garnish and serve.",,"Die Zutaten in einem Mixer mit Eis verrühren. In ein Glas abseihen, garnieren und servieren.",,"Shakerare gli ingredienti insieme in un mixer con ghiaccio.
Filtrare nel bicchiere, guarnire e servire.",,,https://www.thecocktaildb.com/images/media/drink/64x5j41504351518.jpg,Brandy,Port,Egg Yolk,,,,,,,,,,,,,3 parts,9 parts,2 parts,,,,,,,,,,,,,,,No,2017-09-02 12:25:18
178338,Pure Passion,,Passion,,Cocktail,,Alcoholic,Whiskey sour glass,Mix up all ingredients with a cocktail stirrer and serve with crushed ice with mint and edible flour if available.,,,,Mescolare tutti gli ingredienti con un agitatore per cocktail e servire con ghiaccio tritato con menta e farina commestibile se disponibile.,,,https://www.thecocktaildb.com/images/media/drink/4tymma1604179273.jpg,Rum,Passoa,Lime Juice,Passion fruit syrup,Peach Bitters,Mint,,,,,,,,,,40 ml,20 ml,30 ml,15 ml,Dash,Garnish with,,,,,,,,,,,,No,
11983,Quaker's Cocktail,,,,Ordinary Drink,,Alcoholic,Cocktail glass,"Shake all ingredients with ice, strain into a cocktail glass, and serve.",,"Alle Zutaten mit Eis schütteln, in ein Cocktailglas abseihen und servieren.",,"Shakerare tutti gli ingredienti con ghiaccio, filtrare in una coppetta da cocktail e servire.",,,https://www.thecocktaildb.com/images/media/drink/yrqppx1478962314.jpg,Light rum,Brandy,Lemon,Raspberry syrup,,,,,,,,,,,,3/4 oz ,3/4 oz ,Juice of 1/4 ,2 tsp ,,,,,,,,,,,,,,No,2016-11-12 14:51:54
11985,Quarter Deck Cocktail,,,,Ordinary Drink,,Alcoholic,Cocktail glass,"Stir all ingredients with ice, strain into a cocktail glass, and serve.",,"Alle Zutaten mit Eis verrühren, in ein Cocktailglas abseihen und servieren.",,"Mescolare tutti gli ingredienti con ghiaccio, filtrare in una coppetta da cocktail e servire.",,,https://www.thecocktaildb.com/images/media/drink/qrwvps1478963017.jpg,Light rum,Sherry,Lime,,,,,,,,,,,,,1 1/2 ,1/3 oz cream ,Juice of 1/2 ,,,,,,,,,,,,,,,No,2016-11-12 15:03:37
11987,Queen Bee,,,,Ordinary Drink,,Alcoholic,Cocktail glass,"Shake all ingredients with ice, strain into a cocktail glass, and serve.",,"Alle Zutaten mit Eis schütteln, in ein Cocktailglas abseihen und servieren.",,"Shakerare tutti gli ingredienti con ghiaccio, filtrare in una coppetta da cocktail e servire.",,,https://www.thecocktaildb.com/images/media/drink/rvvpxu1478963194.jpg,Coffee brandy,Lime vodka,Sherry,,,,,,,,,,,,,1 oz ,1 1/2 oz ,1/2 oz cream ,,,,,,,,,,,,,,,No,2016-11-12 15:06:34
11989,Queen Charlotte,,,,Ordinary Drink,,Alcoholic,Collins glass,"Pour red wine and grenadine into a collins glass over ice cubes. Fill with lemon-lime soda, stir, and serve.",,"Rotwein und Grenadine in ein Collins-Glas über Eiswürfel gießen. Mit Zitronen-Limetten-Soda auffüllen, umrühren und servieren.",,"Versare il vino rosso e la granatina in un bicchiere Collins sopra i cubetti di ghiaccio.Riempi con la soda al limone e lime, mescola e servi.",,,https://www.thecocktaildb.com/images/media/drink/vqruyt1478963249.jpg,Red wine,Grenadine,Lemon-lime soda,,,,,,,,,,,,,2 oz ,1 oz ,,,,,,,,,,,,,,,,No,2016-11-12 15:07:29
11991,Queen Elizabeth,,,,Ordinary Drink,,Alcoholic,Cocktail glass,"Stir all ingredients with ice, strain into a cocktail glass, and serve.",,"Alle Zutaten mit Eis verrühren, in ein Cocktailglas abseihen und servieren.",,"Mescolare tutti gli ingredienti con ghiaccio, filtrare in una coppetta da cocktail e servire.",,,https://www.thecocktaildb.com/images/media/drink/vpqspv1478963339.jpg,Dry Vermouth,Gin,Benedictine,,,,,,,,,,,,,1/2 oz ,1 1/2 oz ,1 1/2 tsp ,,,,,,,,,,,,,,,No,2016-11-12 15:08:59
11993,Quentin,,,,Ordinary Drink,,Alcoholic,Cocktail glass,"In a shaker half-filled with ice cubes, combine the rum, Kahlua, and cream. Shake well. Strain into a cocktail glass and garnish with the nutmeg.",,"In einem Shaker, der halb mit Eiswürfeln gefüllt ist, Rum, Kahlua und Sahne mischen. Gut schütteln. In ein Cocktailglas abseihen und mit der Muskatnuss garnieren.",,"In uno shaker riempito a metà con cubetti di ghiaccio, unire il rum, il Kahlua e la panna. Filtrare in una coppetta da cocktail e guarnire con la noce moscata. Agitare bene.",,,https://www.thecocktaildb.com/images/media/drink/spxtqp1478963398.jpg,Dark rum,Kahlua,Light cream,Nutmeg,,,,,,,,,,,,1 1/2 oz ,1/2 oz ,1 oz ,1/8 tsp grated ,,,,,,,,,,,,,,No,2016-11-12 15:09:58
13198,Quick F**K,,,,Shot,,Alcoholic,Shot glass,"In a shot glass add 1/3 Kahlua first. Then 1/3 Miduri, topping it off with a 1/3 bailey's irish cream",,"In einem Schnapsglas zuerst 1/3 Kahlua geben. Dann 1/3 Miduri, ergänzt durch 1/3 Bailey's irish Cream.",,"In un bicchierino aggiungere prima 1/3 di Kahlua.
Quindi 1/3 di Midori, completando con 1/3 di crema irlandese di bailey",,,https://www.thecocktaildb.com/images/media/drink/wvtwpp1478963454.jpg,Kahlua,Midori melon liqueur,Baileys irish cream,,,,,,,,,,,,,1 part ,1 part ,1 part ,,,,,,,,,,,,,,,No,2016-11-12 15:10:54
15761,Quick-sand,,,,Ordinary Drink,,Alcoholic,Highball glass,"Simply add the orange juice, quite a quick pour in order to mix the sambucca with the orange juice. The juice MUST have fruit pulp!",,"Einfach den Orangensaft zugeben und ganz schnell gießen, um den Sambucca mit dem Orangensaft zu mischen. Der Saft MUSS Fruchtfleisch enthalten!",,"Basta aggiungere il succo d'arancia, abbastanza veloce per amalgamare la sambuca con il succo d'arancia.
Il succo deve avere polpa di frutta!",,,https://www.thecocktaildb.com/images/media/drink/vprxqv1478963533.jpg,Black Sambuca,Orange juice,,,,,,,,,,,,,,25 ml ,Add 250 ml ,,,,,,,,,,,,,,,,No,2016-11-12 15:12:13
16984,Radioactive Long Island Iced Tea,,,,Ordinary Drink,,Alcoholic,Collins Glass,Pour all ingredients over ice in a very tall glass. Sip cautiously.,,Alle Zutaten in einem sehr hohen Glas über Eis gießen. Vorsichtig nippen.,,"Versare tutti gli ingredienti sul ghiaccio in un bicchiere molto alto.
Sorseggia con cautela.",,,https://www.thecocktaildb.com/images/media/drink/rdvqmh1503563512.jpg,Rum,Vodka,Tequila,Gin,Triple sec,Chambord raspberry liqueur,Midori melon liqueur,Malibu rum,,,,,,,,1 oz ,1 oz ,1 oz ,1 oz ,1 oz ,1 oz ,1 oz ,1 oz ,,,,,,,,,,No,2017-08-24 09:31:52
16031,Radler,,,,Ordinary Drink,,Alcoholic,Highball glass,"Pour beer into large mug, slowly add the 7-up (or Sprite).",,"Bier in einen großen Becher gießen, langsam den 7-up (oder Sprite) hinzufügen.",,"Versare la birra in una tazza grande, aggiungere lentamente il 7up (o Sprite).",,,https://www.thecocktaildb.com/images/media/drink/xz8igv1504888995.jpg,Beer,7-Up,,,,,,,,,,,,,,12 oz ,12 oz ,,,,,,,,,,,,,,,,No,2017-09-08 17:43:15
17167,Raspberry Cooler,,,,Other/Unknown,,Alcoholic,Highball glass,Pour the raspberry vodka and soda into a highball glass almost filled with ice cubes. Stir well.,,"Geben Sie den Himbeer-Wodka und das Soda in ein Highball-Glas, das fast mit Eiswürfeln gefüllt ist. Gut umrühren.",,"Versare la vodka ai lamponi e la soda in un bicchiere highball quasi pieno di cubetti di ghiaccio.
Mescolare bene.",,,https://www.thecocktaildb.com/images/media/drink/suqyyx1441254346.jpg,Raspberry vodka,Lemon-lime soda,Ice,,,,,,,,,,,,,2 oz ,4 oz ,,,,,,,,,,,,,,,,No,2015-09-03 05:25:46
178333,Raspberry Julep,,,,Cocktail,,Alcoholic,Cordial glass,"Softly muddle the mint leaves and raspberry syrup in the bottom of the cup. Add crushed ice and Bourbon to the cup and then stir. Top with more ice, garnish with a mint sprig.",,,,"Pestare delicatamente le foglie di menta e lo sciroppo di lamponi sul fondo della tazza. Aggiungere il ghiaccio tritato e il Bourbon nella tazza e poi mescolare. Completare con altro ghiaccio, guarnire con un rametto di menta.",,,https://www.thecocktaildb.com/images/media/drink/hyztmx1598719265.jpg,Bourbon,Raspberry syrup,Mint,,,,,,,,,,,,,2 oz,1/2 oz,8,,,,,,,,,,,,,,,No,
14087,Red Snapper,,,,Shot,,Alcoholic,Old-fashioned glass,"One shot each, shake n shoot",,"Jeweils ein Shot, schütteln und schießen.",,Versa in un bicchiere tutti gli ingredienti. Mescolare.,,,https://www.thecocktaildb.com/images/media/drink/7p607y1504735343.jpg,Crown Royal,Amaretto,Cranberry juice,,,,,,,,,,,,,1 shot ,1 shot ,1 shot ,,,,,,,,,,,,,,,No,2017-09-06 23:02:23
17208,Rose,,"IBA,ContemporaryClassic",,Ordinary Drink,Contemporary Classics,Alcoholic,Cocktail glass,"Shake together in a cocktail shaker, then strain into chilled glass. Garnish and serve.",,In einem Cocktailshaker vermengen und dann in ein gekühltes Glas abseihen. Garnieren und servieren.,,"Shakerare insieme in uno shaker, quindi filtrare in un bicchiere freddo.
Guarnire e servire.",,,https://www.thecocktaildb.com/images/media/drink/8kxbvq1504371462.jpg,Dry Vermouth,Gin,Apricot brandy,Lemon juice,Grenadine,Powdered sugar,,,,,,,,,,1/2 oz ,1 oz ,1/2 oz ,1/2 tsp ,1 tsp ,,,,,,,,,,,,,No,2017-09-02 17:57:42
17245,Rosemary Blue,,,,Cocktail,,Alcoholic,Balloon Glass,"1) Add the Bombay Sapphire, Blue Curacao, rosemary sprig and gently squeezed lemon wedge to a balloon glass. Swirl well to combine.
2) Fill with cubed ice and top with the Fever-Tree Light Tonic Water.
3) Gently fold with a bar spoon to mix.",,"Fügen Sie den Bombay Saphir, Blauen Curacao, Rosmarinzweig und den sanft ausgedrückten Zitronenkeil in ein Ballonglas ein. Gut mischen. Mit Eiswürfel füllen und mit dem Fever-Tree Light Tonic Water auffüllen. Vorsichtig mit einem Barlöffel zum Mischen verrühren.",,"1) Aggiungere il Bombay Sapphire, il Blue Curacao, il rametto di rosmarino e uno spicchio di limone leggermente spremuto in un bicchiere a palloncino.
Agita bene per combinare.
2) Riempire con ghiaccio a cubetti e ricoprire con l'acqua tonica Fever-Tree Light.
3) Piegare delicatamente con un cucchiaio da bar per mescolare.",,,https://www.thecocktaildb.com/images/media/drink/qwc5f91512406543.jpg,Gin,Blue Curacao,Tonic Water,Rosemary,,,,,,,,,,,,50 ml,15 ml,100 ml,Garnish with,,,,,,,,,,,,,,No,2017-12-04 16:55:43
17122,Royal Bitch,,,,Shot,,Alcoholic,Shot glass,Into a shot glass layer the Crown Royal on top of the Frangelico.,,In einem Schnapsglas die Crown Royal auf den Frangelico schichten.,,In un bicchiere da shot versa a strati prima il Frangelico e infine il Crown Royal,,,https://www.thecocktaildb.com/images/media/drink/qupuyr1441210090.jpg,Frangelico,Crown Royal,,,,,,,,,,,,,,1 part ,1 part ,,,,,,,,,,,,,,,,No,2015-09-02 17:08:10
12055,Royal Fizz,,,,Ordinary Drink,,Alcoholic,Collins glass,Shake all ingredients (except cola) with ice and strain into a chilled collins glass. Fill with cola and serve.,,Alle Zutaten (außer Cola) mit Eis schütteln und in ein gekühltes Collins-Glas abseihen. Mit Cola auffüllen und servieren.,,Shakerare tutti gli ingredienti (tranne la cola) con ghiaccio e filtrare in un bicchiere collins freddo. Riempi con cola e servi,,,https://www.thecocktaildb.com/images/media/drink/wrh44j1504390609.jpg,Gin,Sweet and sour,Egg,Coca-Cola,,,,,,,,,,,,1 oz ,2 oz ,1 whole ,,,,,,,,,,,,,,,No,2017-09-02 23:16:49
